Unique ID,Name,Age,Gender,Race,Race with imputations,Imputation probability,URL of image (PLS NO HOTLINKS), Date of injury resulting in death (month/day/year),Location of injury (address),Location of death (city),State,Location of death (zip code),Location of death (county),Full Address,Latitude,Longitude,Agency or agencies involved,Highest level of force,UID Temporary,Name Temporary,Armed/Unarmed,Alleged weapon,Aggressive physical movement,Fleeing/Not fleeing,Description Temp,URL Temp,Brief description,"Dispositions/Exclusions INTERNAL USE, NOT FOR ANALYSIS",Intended use of force (Developing),Supporting document link,"Foreknowledge of mental illness? INTERNAL USE, NOT FOR ANALYSIS",,,Unique ID formula,Unique identifier (redundant)
31495,Ashley McClendon,28,Female,African-American/Black,African-American/Black,Not imputed,https://fatalencounters.org/wp-content/uploads/2022/01/Ashley-McClendon.jpg,12/31/2021,South Pearl Street and Tory Road,Pageland,SC,29728,Chesterfield,South Pearl Street and Tory Road Pageland SC 29728 Chesterfield,34.7452955,-80.3930567,Pageland Police Department,Vehicle,,,,,,,,,"Ashley McClendon's boyfriend, 33-year-old Marcus Allen Davis, allegedly was driving a 1996 Ford Coupe back to Pageland when an officer reportedly saw the car run a stop sign before midnight on Dec. 31. A traffic stop was attempted, but Davis refused to stop. As the car fled down South Pearl Street near Tory Road it left the road and struck a tree, killing passenger McClendon.",Criminal,Pursuit,https://www.wsoctv.com/news/1-person-dead-after-attempting-escape-police-troopers-say/QXA244QPUZGJ5GAGRADGDWBAEU/,No,,,,31495
31493,Ny'Darius McKinney,21,Male,Race unspecified,NA,NA,,12/30/2021,State Rd S-29-296 & Bethel Rd,Lancaster,SC,29720,Lancaster,State Rd S-29-296 & Bethel Rd Lancaster SC 29720 Lancaster,34.6608217,-80.8371371,South Carolina Law Enforcement Division,Vehicle,,,,,,,,,"About 5:35 p.m., Joseph Jemar Hinson was allegedly driving a car when police tried to pull him over, and he fled. Police pursued him until he ran off the left side of the roadway, struck a fence and wrecked, killing back seat passenger Ny'Darius McKinney. Hinson was charged with failure to stop for a blue light resulting in death.",Criminal,Pursuit,https://www.thelancasternews.com/content/21-year-old-man-killed-when-car-fleeing-police-crashes,No,,,,31493
31457,Matthew David Snyder,38,Male,Race unspecified,NA,NA,,12/26/2021,Twin Falls Rd and Black Oak Ct,Simpsonville,SC,29680,Greenville,Twin Falls Rd and Black Oak Ct Simpsonville SC 29680 Greenville,34.732708,-82.301292,Greenville County Sheriff's Office,Gunshot,,,,,,,,,"Deputies were called about a domestic-related incident around 8:30 p.m. When they arrived, deputies said they learned Matthew David Snyder had left. Deputies said the armed man was found and negotiations took place for about 45 minutes, until he was shot an killed about 11 p.m.",Pending investigation,Deadly force,https://www.wyff4.com/article/suspect-dies-greenville-county-shooting/38621966,No,,,,31457
31430,Robert Alan Beach II,42,Male,European-American/White,European-American/White,Not imputed,https://fatalencounters.org/wp-content/uploads/2021/12/Robert-Alan-Beach-II.jpg,12/20/2021,,Wellford,SC,29385,Spartanburg,Wellford SC 29385 Spartanburg,34.9509521,-82.1059416,Spartanburg County Sheriff's Office,Gunshot,,,,,,,,,"A Spartanburg County deputy tried to pull over Robert Alan Beach II late Sunday. A chase followed, ending in forcible stop. Deputies approached to find Beach with a gun to his head, threatening to kill himself. After 7 a.m., sheriff's officials decided to tear-gas the car. Beach shot and killed himself.",Suicide,Suicide,https://abcnews4.com/news/local/deputies-sc-man-kills-himself-after-chase-and-standoff-wciv,No,,,,31430
31340,"Brandon ""BJ"" Joshua Mauldin",32,Male,European-American/White,European-American/White,Not imputed,https://fatalencounters.org/wp-content/uploads/2021/12/BrandonMauldin.jpg,12/15/2021,Queen Anne Ln,Liberty,SC,29657,Anderson,Queen Anne Ln Liberty SC 29657 Anderson,34.7098074,-82.6250926,Anderson County Sheriff's Department,Gunshot,,,,,,,,,"Around 8 p.m., deputies were trying to stop a car being driven by Brandon Mauldin, who had outstanding warrants for first-degree domestic violence, resisting arrest and receiving stolen goods. Deputies found out where Mauldin was staying and approached the residence, but Mauldin fled. A short pursuit arrived to a dead end behind a home. Mauldin's truck got stuck, and deputies got out to order Mauldin to give himself up. Deputies shot and killed Mauldin.",Pending investigation,Deadly force,https://www.foxcarolina.com/news/deputies-1-dead-after-deputy-involved-shooting-in-anderson-county/article_6b3fe812-5e1d-11ec-b18e-b716f749ac24.html?block_id=994016,No,,,,31340
31118,Robert Allen Maness,39,Male,Race unspecified,NA,NA,,10/14/2021,Airline Rd and Mimosa Trl,Anderson,SC,29624,Anderson,Airline Rd and Mimosa Trl Anderson SC 29624 Anderson ,34.3889055,-82.6089503,Anderson County Sheriff's Office,Gunshot,,,,,,,,,"Robert Allen Maness, who was on a motorcycle, fired on officers as they tried to pull him over. He was shot and killed and crashed around 11 p.m.",Pending investigation,Deadly force,https://www.wfxg.com/story/44972949/sheriff-officers-kill-man-who-fired-on-them-from-motorcycle,No,,,,31118
31107,Jonathan Zachary Combs,40,Male,European-American/White,European-American/White,Not imputed,https://fatalencounters.org/wp-content/uploads/2021/12/Jonathan-Zachary-Combs.jpg,10/12/2021,I-85 and SC-8,Pelzer,SC,29669,Anderson,I-85 and SC-8 Pelzer SC 29669 Anderson ,34.67474358,-82.53682099,Anderson County Sheriff's Office,Gunshot,,,,,,,,,"Following a pursuit, a deputy shot and killed Jonathan Zachary Combs as he reportedly got out of the car and presented a firearm.",Pending investigation,Deadly force,https://www.independentmail.com/story/news/local/2021/10/12/anderson-sheriffs-deputy-shoots-person-after-chase-ends-85/8423993002/,No,,,,31107
31085,Derrick Clinton II,27,Male,African-American/Black,African-American/Black,Not imputed,https://fatalencounters.org/wp-content/uploads/2021/12/Derrick-Clinton-II.jpg,10/08/2021,3000 Fast Ln,Indian Land,SC,29707,Lancaster,3000 Fast Ln Indian Land SC 29707 Lancaster,35.0050911,-80.8508462,Lancaster County Sheriff's Office,Gunshot,,,,,,,,,"Around 6 p.m. deputies were doing a welfare check on Derrick Clinton II. Clinton had been reported missing by family members. Officers were unable to get anyone to answer the door and had obtained a search warrant to enter the apartment. Deputies entered, and Clinton was inside and fired upon the, reportedly striking one. A deputy shot and killed him.",Pending investigation,Deadly force,https://www.live5news.com/2021/10/09/man-dead-deputy-taken-hospital-after-officer-involved-shooting-lancaster-county/,No,,,,31085
31030,Carlos Antonio Douglas,38,Male,African-American/Black,African-American/Black,Not imputed,https://fatalencounters.org/wp-content/uploads/2021/11/Carlos-Antonio-Douglas.jpg,09/30/2021,Freedom Boulevard and Pamplico Highway,Florence,SC,29505,Florence,Freedom Boulevard and Pamplico Highway Florence SC 29505 Florence,34.1606782,-79.7560499,Florence County Sheriff's Office,Vehicle,,,,,,,,,"About 3:20 a.m., a deputy spotted a car driving 90 mph on Alligator Road. The deputy activated the blue lights and siren and tried to stop the vehicle. The deputy reportedly backed off the pursuit as the vehicle approached a red light at an intersection. Shortly after going through the intersection, police said the vehicle lost control, crossed the median, ran through a fence surrounding a retention pond and went into the water. Carlos Antonio Douglas was killed.",Pending investigation,Deadly force,https://www.wmbfnews.com/2021/09/30/vehicle-runs-into-pond-during-pursuit-florence-county-sheriff-says/,No,,,,31030
30988,Jason Thomas Husted,47,Male,European-American/White,European-American/White,Not imputed,,09/18/2021,2567 Mona Avenue,Charleston,SC,29414,Charleston,2567 Mona Avenue Charleston SC 29414 Charleston,32.8354854,-80.0518115,Charleston County Sheriff's Office,Gunshot,,,,,,,,,Deputies were dispatched about 7:30 a.m. after neighbors reported a man was firing a gun. A deputy shot and killed Jason Thomas Husted in an exchange of gunfire.,Justified by District Attorney,Deadly force,https://www.postandcourier.com/news/1-dead-after-officer-involved-shooting-in-west-ashley-neighborhood/article_503ef76c-188e-11ec-896d-c70230241154.html,No,,,,30988
30949,Tristan Marcelous Vereen,33,Male,African-American/Black,African-American/Black,Not imputed,https://fatalencounters.org/wp-content/uploads/2021/10/Tristan-Marcelous-Vereen.jpg,09/11/2021,SC 905 and McNeil Chapel Road,Longs,SC,29568,Horry,SC 905 and McNeil Chapel Road Longs SC 29568 Horry,33.9071116,-78.8295815,South Carolina Highway Patrol,Gunshot,,,,,,,,,"A South Carolina trooper was patrolling on SC 905 near SC22 when he attempted a traffic stop for an equipment violation on a vehicle around 3:48 p.m. The vehicle sped away, traveling north on SC 905. The trooper pursued the vehicle until the driver crashed his vehicle into a utility building in a residential yard. Driver Tristan Vereen reportedly fled on foot. When the trooper attempted to place the individual under arrest, a fight began, and the trooper shot and killed Vereen.",Pending investigation,Deadly force,https://wpde.com/news/local/police-and-emergency-crews-responding-to-an-incident-impacting-traffic-on-highway-905,No,,,,30949
30800,Brianna Lynn Foster,18,Female,European-American/White,European-American/White,Not imputed,https://fatalencounters.org/wp-content/uploads/2021/09/Brianna-Lynn-Foster.jpg,08/16/2021,I-26,Inman,SC,29349,Spartanburg,I-26 Inman SC 29349 Spartanburg,35.03438037,-82.03576521,Inman Police Department,Vehicle,,,,,,,,,"An Inman officer was pursuing Melissa Ann Parker who allegedly was driving a 2005 Hummer when she hit a four-door Kia sedan with a driver and three passengers heading east. Elleana Lee Gaddis, 17, and her twin sister Isabella Lee Gaddis, 17, and Brianna Lynn Foster, 18, were killed.",Pending investigation,Pursuit,https://www.goupstate.com/story/news/2021/08/30/dui-fatal-crash-spartanburg-involved-inman-police-pursuit/5647696001/,Drug or alcohol use,,,,30800
30801,Elleana Lee Gaddis,17,Female,European-American/White,European-American/White,Not imputed,https://fatalencounters.org/wp-content/uploads/2021/09/Elleana-Lee-Gaddis.jpg,08/16/2021,I-26,Inman,SC,29349,Spartanburg,I-26 Inman SC 29349 Spartanburg,35.03438037,-82.03576521,Inman Police Department,Vehicle,,,,,,,,,"An Inman officer was pursuing Melissa Ann Parker who allegedly was driving a 2005 Hummer when she hit a four-door Kia sedan with a driver and three passengers heading east. Elleana Lee Gaddis, 17, and her twin sister Isabella Lee Gaddis, 17, and Brianna Lynn Foster, 18, were killed.",Pending investigation,Pursuit,https://www.goupstate.com/story/news/2021/08/30/dui-fatal-crash-spartanburg-involved-inman-police-pursuit/5647696001/,Drug or alcohol use,,,,30801
30802,Isabella Lee Gaddis,17,Female,European-American/White,European-American/White,Not imputed,https://fatalencounters.org/wp-content/uploads/2021/09/Isabella-Lee-Gaddis.jpg,08/16/2021,I-26,Inman,SC,29349,Spartanburg,I-26 Inman SC 29349 Spartanburg,35.03438037,-82.03576521,Inman Police Department,Vehicle,,,,,,,,,"An Inman officer was pursuing Melissa Ann Parker who allegedly was driving a 2005 Hummer when she hit a four-door Kia sedan with a driver and three passengers heading east. Elleana Lee Gaddis, 17, and her twin sister Isabella Lee Gaddis, 17, and Brianna Lynn Foster, 18, were killed.",Pending investigation,Pursuit,https://www.goupstate.com/story/news/2021/08/30/dui-fatal-crash-spartanburg-involved-inman-police-pursuit/5647696001/,Drug or alcohol use,,,,30802
30784,Phillip John Walden,40,Male,European-American/White,European-American/White,Not imputed,https://fatalencounters.org/wp-content/uploads/2021/09/Phillip-John-Walden.jpeg,08/15/2021,I-26,Chapin,SC,29036,Lexington,I-26 Chapin SC 29036 Lexington,34.178535,-81.32513137,Newberry County Sheriff's Office,Gunshot,,,,,,,,,"Deputies got a call about an overturned vehicle on I-26 around 5:51 p.m. A person who stopped to help was then carjacked. The stolen vehicle was spotted, and deputies pursued. The stolen vehicle reportedly hit several cars on the interstate, including a deputy's car, during the pursuit. After the chase ended for unspecified reasons, deputies say the driver got out of the car and charged at police. A deputy shot and killed the person. Whether the person was armed at the time of the killing, or what weapon the person had at the time of the carjacking was not reported.",Pending investigation,Deadly force,https://www.wistv.com/2021/08/16/sled-investigating-officer-involved-shooting/,No,,,,30784
30573,Robert Wayne Crocker,52,Male,European-American/White,European-American/White,Not imputed,https://fatalencounters.org/wp-content/uploads/2021/08/Robert-Crocker.jpg,07/07/2021,207 White Plains Road,Gaffney,SC,29340,Cherokee,207 White Plains Road Gaffney SC 29340 Cherokee,35.015967,-81.724789,Cherokee County Sheriff's Office,Gunshot,,,,,,,,,"Robert Crocker was wanted for attempted murder and possession of a weapon during a violent crime charges. Crocker was in the driver's seat of a van that was parked outside a residence.Officers arrived at around 12:35 p.m. After trying to communicate with Crocker, deputies reported having heard a pop-like sound from inside the van at about 1:20 p.m. Crocker was found unresponsive once officers made entry to the van at 2:30 p.m.",Suicide,Suicide,https://www.foxcarolina.com/news/coroner-suspect-identified-who-died-due-to-self-inflicted-gunshot-wound-after-standoff/article_54edccd4-df54-11eb-bf15-83b82a5e0ea7.html,Unknown,,,,30573
30545,Shannon Earl Smith,45,Male,African-American/Black,African-American/Black,Not imputed,https://fatalencounters.org/wp-content/uploads/2021/08/Shannon-Earl-Smith.jpg,07/01/2021,225 Amelia St.,Spartanburg,SC,29303,Spartanburg,225 Amelia St. Spartanburg SC 29303 Spartanburg,34.9629172,-81.9502211,"Spartanburg Police Department, Spartanburg County Sheriff's Office",Gunshot,,,,,,,,,"The reporting of this story is so convoluted, it's difficult to tell the sequence of events. News media reported that Shannon Smith approached people making sewer line repairs in his neighborhood. He shot two, killing one, and fled to his home, where he was shot and killed during a short standoff.",Pending investigation,Deadly force,https://www.wjbf.com/news/south-carolina-news/deputy-2-spartanburg-water-employees-shot-near-cleveland-park-in-spartanburg/,No,,,,30545
30531,"John ""Hayden"" Inabinet III",51,Male,European-American/White,European-American/White,Not imputed,https://fatalencounters.org/wp-content/uploads/2021/08/John-Hayden-Inabinet-III.jpg,06/30/2021,1488 Burke Road,St. Matthews,SC,29135,Calhoun,1488 Burke Road St. Matthews SC 29135 Calhoun,33.6258835,-80.887832,Calhoun County Sheriff's Office,Gunshot,,,,,,,,,"Deputies were called to a report of shots fired around 11 a.m. When deputies arrived, they spoke with a family member who said that his father, John ""Hayden"" Inabinet III, had opened fire at him when he attempted to come on the property to pick up some of his personal items. A deputy shot and killed Inabinet when Inabinet allegedly pointed a gun at the deputy.",Pending investigation,Deadly force,https://www.wltx.com/article/news/crime/calhoun-county-sheriff-new-details-fatal-shooting-suspect/101-5533bbad-315a-402b-9f6b-44730e7b1fc4,No,,,,30531
30515,"Marcus ""Mark"" Gattis",58,Male,European-American/White,European-American/White,Not imputed,https://fatalencounters.org/wp-content/uploads/2021/08/Marcus-Mark-Gattis.jpg,06/27/2021,SC-9 & SC-66,Loris,SC,29569,Horry,SC-9 & SC-66 Loris SC 29569 Horry,34.06286,-78.8508111,Horry County Police Department,Vehicle,,,,,,,,,"Officer Justin Jones, 44, was driving a 2021 Ford Explorer registered to Horry County government when he collided with a 1996 GMC pickup truck, killing the driver, Marcus Gattis.",Pending investigation,Vehicle,https://www.myrtlebeachonline.com/news/local/crime/article252417558.html,No,,,,30515
30493,Name withheld by police,,,Race unspecified,NA,NA,,06/24/2021,SC-57 and Harshaw Lane,Little River,SC,29566,Horry,SC-57 and Harshaw Lane Little River SC 29566 Horry,33.901504,-78.665597,Horry County Police Department,Vehicle,,,,,,,,,"A 2005 Honda Accord was driving down Highway 57 allegedly attempting to elude police, when the car ran off the right side of the road and hit a tree and a power pole, killing the driver.",Pending investigation,Pursuit,https://www.myrtlebeachonline.com/news/local/crime/article252329318.html,No,,,,30493
30477,Earl Fitzgerald Hunter,40,Male,African-American/Black,African-American/Black,Not imputed,https://fatalencounters.org/wp-content/uploads/2021/08/Earl-Fitzgerald-Hunter.jpg,06/23/2021,85 Montague Road,Fountain Inn,SC,29644,Greenville,85 Montague Road Fountain Inn SC 29644 Greenville,34.6945692,-82.1440392,Greenville County Sheriff's Office,Gunshot,,,,,,,,,"About 5 p.m., deputies working on a U.S. Marshals Service task force responded to a duplex on Montague Road to find a person who had at least one active warrant. Earl Fitzgerald Hunter was shot and killed after a struggle with at least one deputy who was trying to serve an arrest warrant. Hunter was wanted in connection to a shooting that occurred in December. Deputies say Hunter attempted to kill his ex-girlfriend.",Justified by internal review,Deadly force,https://www.greenvilleonline.com/story/news/local/south-carolina/2021/06/23/greenville-county-sheriffs-office-deputy-involved-shooting/5328499001/,No,,,,30477
30435,"Christopher ""Chris"" Schirrod Butler",46,Male,African-American/Black,African-American/Black,Not imputed,https://fatalencounters.org/wp-content/uploads/2021/07/Christopher-Schirrod-Butler.jpg,06/16/2021,"34.508730, -81.953770 Torrington Road",Laurens,SC,29360,Laurens,"34.508730, -81.953770 Torrington Road Laurens SC 29360 Laurens",34.4947324,-81.933906,Laurens County Sheriff's Office,Vehicle,,,,,,,,,"Deputies were traveling on Highway 76 East from Clinton to Laurens when they saw a silver car with a large TV box on the roof. They noticed that the driver and the front-seat passenger were holding the TV box to the roof with their hands. They followed the vehicle. The car reportedly also matched the description of a recent theft from Walmart involving a stolen TV. Deputies got close enough to the vehicle to read the tag and communicate it to dispatch. However, the TV box fell off the roof, so deputies say they activated their emergency lights and attempted to stop the vehicle. The driver then began to increase their speed and fled, until the driver went around a curve, lost control of the vehicle and struck a telephone pole off the side of the roads. Driver Christopher Butler was killed.",Pending investigation,Deadly force,https://www.foxcarolina.com/news/coroner-identifies-victim-killed-in-laurens-co-police-chase-that-ended-in-crash/article_76a6c9fa-cefd-11eb-b494-e3ec88976c45.html,No,,,,30435
30421,Evin Kimberly Payne,54,Male,Race unspecified,NA,NA,,06/14/2021,River Oaks Drive,Iva,SC,29655,Abbeville,River Oaks Drive Iva SC 29655 Abbeville,34.2434206,-82.6317704,Abbeville County Sheriff's Office,Gunshot,,,,,,,,,"Deputies were called out at about 11 p.m. to a home in Iva to investigate a person at risk of killing themselves along with a domestic dispute. There, Evin Kimberly Payne allegedly pointed a firearm and failed to comply with attempts to get him to disarm. An officer shot and killed him.",Pending investigation,Deadly force,https://www.indexjournal.com/news/crime/sled-investigates-fatal-shooting-by-abbeville-deputies/article_4ea4fd45-b45a-540d-9c34-fd849dc87716.html,Yes,,,,30421
30385,Clint Christopher Morris,42,Male,European-American/White,European-American/White,Not imputed,https://fatalencounters.org/wp-content/uploads/2021/07/morris-clint-christopher.png,06/07/2021,Middle Willow Road and Rutland Road,Neeses,SC,29107,Orangeburg,Middle Willow Road and Rutland Road Neeses SC 29107 Orangeburg,33.477931,-81.046804,"Bamberg County Sheriff's Office, Bamberg Police Department, Orangeburg County Sheriff's Office, South Carolina Highway Patrol",Vehicle,,,,,,,,,"Clint Christopher Morris was driving a 2004, heavy-duty GMC Sierra 2500 pickup that was reported stolen from the Branchville area. The truck reportedly had a .22-caliber revolver inside at the time of the theft. Multiple police agencies chased the truck across two counties until Morris crashed into a tree and was killed.",Pending investigation,Pursuit,https://thetandd.com/news/local/crime-and-courts/person-killed-in-crash-identified-truck-led-officers-on-bamberg-orangeburg-county-chase/article_187c8bd8-b6b0-5219-bcf9-95f16c33f02e.html,No,,,,30385
30361,Lloyd C. Smalls,60,Male,African-American/Black,African-American/Black,Not imputed,https://fatalencounters.org/wp-content/uploads/2021/07/Lloyd-C.-Smalls.png,06/04/2021,SC-63 and Cobb Court,Walterboro,SC,29488,Colleton,SC-63 and Cobb Court Walterboro SC 29488 Colleton,32.8834047,-80.7011771,Colleton County Sheriff's Office,Vehicle,,,,,,,,,Cpl. Isaiah Bahrenburg struck and killed pedestrian Lloyd C. Smalls with his patrol vehicle. Police said it happened in a poorly lit area of Sniders Highway while deputies were responding to a 911 call.,Pending investigation,Vehicle,https://www.counton2.com/news/local-news/colleton-county-news/schp-investigating-deadly-pedestrian-crash-in-colleton-county/,No,,,,30361
30344,Jerry Delmar Sweeper,39,Male,African-American/Black,African-American/Black,Not imputed,https://fatalencounters.org/wp-content/uploads/2021/07/Jerry-Delmar-Sweeper.jpg,05/30/2021,Winter Creek Road and Arista Road,Bowman,SC,29018,Orangeburg,Winter Creek Road and Arista Road Bowman SC 29018 Orangeburg,33.3840831,-80.6404577,South Carolina Highway Patrol,Vehicle,,,,,,,,,"Jerry Delmar Sweeper was operating a 2003 white Saturn L200 when he approached a traffic safety checkpoint conducted by the S.C. Highway Patrol. Sweeper allegedly told a trooper that he needed to pull to the edge of the road to retrieve his driver's license before fleeing. The trooper chased Sweeper until he crashed into a tree, killing him.",Pending investigation,Pursuit,https://thetandd.com/news/local/crime-and-courts/man-dies-during-chase-by-schp-in-orangeburg-county-39-year-old-allegedly-fled-traffic/article_325149af-d740-5365-8d17-3863273111d2.html,No,,,,30344
30200,Jeffrey Mark Murray,62,Male,Race unspecified,NA,NA,,05/09/2021,825 Verdae Blvd,Greenville,SC,29607,Greenville,825 Verdae Blvd Greenville SC 29607 Greenville,34.8304105,-82.3184387,Greenville Police Department,Gunshot,,,,,,,,,"Jeffrey Mark Murray shot and killed cyclist David ""Whit"" Oliver, 44. Officers found Murray's vehicle on Verdae Boulevard, and stopped the vehicle at the fire department. Murray stopped and got out of his vehicle armed with a firearm and there was an exchange of gunfire, and Murray was shot and killed.",Pending investigation,Deadly force,https://www.wyff4.com/article/shooting-near-park-leaves-one-dead-says-coroner-1620587870/36375265#,No,,,,30200
30127,Michael Henry Miller,60,Male,Race unspecified,NA,NA,,04/25/2021,Neely Ferry Road and Wasson Gin Road,Laurens,SC,29360,Laurens,Neely Ferry Road and Wasson Gin Road Laurens SC 29360 Laurens,34.5077159,-82.1805936,Laurens County Sheriff's Office,Burned/Smoke inhalation,,,,,,,,,"Following a police pursuit, biker Michael Henry Miller pulled over in a tavern parking lot. When police took him off the bike, the passenger got off too. There was no gas cap on the bike, and the fuel spilled into the parking lot, the hot pipes set it on fire, and Miller was engulfed in flames, killing him.",Pending investigation,Less-than-lethal force,https://www.wkrg.com/biker-dad/biker-dad-biker-dies-when-his-motorcycle-bursts-into-flames-after-police-chase/,No,,,,30127
30041,Stephen B. Swears,56,Male,European-American/White,European-American/White,Not imputed,https://fatalencounters.org/wp-content/uploads/2021/04/Stephen-B.-Swears.jpg,04/14/2021,Fox Run Rd & Hwy 15 S,St. George,SC,29477,Dorchester,Fox Run Rd & Hwy 15 S St. George SC 29477 Dorchester,33.1124026,-80.592209,St. George Police Department,Vehicle,,,,,,,,,"Stephen B. Swears was wanted out of West Palm Beach, Florida, in connection to a kidnapping. St. George PD who spotted Swears, and chased him. The 2013 Ford Mustang, which was being driven by Swears, was traveling south on Highway when it ran off the road, lost control, crossed into the northbound lane, and struck a 2012 Ford Fusion about 11:30 a.m. The driver of the Ford Fusion was taken to a hospital with injuries. Swears was killed in the crash.",Pending investigation,Pursuit,https://www.counton2.com/news/local-news/portion-of-highway-15-south-in-st-george-shut-down-due-to-crash/,No,,,,30041
30020,Freddie Holmes Jr.,25,Male,African-American/Black,African-American/Black,Not imputed,https://fatalencounters.org/wp-content/uploads/2021/05/Freddie-Holmes.jpg,04/12/2021,I-95,Hardeeville,SC,29927,Jasper,I-95 Hardeeville SC 29927 Jasper,32.253943,-81.114971,Port Wentworth Police Department,Vehicle,,,,,,,,,"During a police chase of a Honda Accord that originated in Port Wentowrth, Freddie Holmes Jr. crashed and was killed around the 2.5-mile marker of I-95 in Jasper County.",Pending investigation,Pursuit,https://www.wjcl.com/article/coroner-chase-led-to-deadly-i-95-tractor-trailer-crash-near-georgia-south-carolina-state-line/36103152,No,,,,30020
