19212,Jason Kastelhun,28,Male,European-American/White,European-American/White,Not imputed,https://www.fatalencounters.org/wp-content/uploads/2013/10/Jason-Kastelhun.jpg,01/09/2010,179 Grapevine Road,Summerville,SC,29483,Dorchester,179 Grapevine Road Summerville SC 29483 Dorchester,33.036456,-80.216491,Dorchester County Sheriff's Office,Gunshot,,,,,,,,,"Deputy Andy Martin shot and killed a drunk and reportedly suicidal man who ignored commands to drop a pistol and instead pointed it at the deputy. He died from wounds to the throat, chest and abdomen.",Justified,Deadly force,http://www.postandcourier.com/article/20100112/PC1602/301129970,Yes,,,,19212
19213,Robert Dewayne Davies,36,Male,European-American/White,European-American/White,Not imputed,,01/09/2010,South Paraham Rd.,Clover,SC,29710,York,South Paraham Rd. Clover SC 29710 York,35.0750047,-81.1545079,Clover Police Department,Vehicle,,,,,,,,,"An officer spotted a speeding truck. The truck didn't stop when the officer turned on blue lights and a siren. As they approached Clover High School, the vehicle started swerving in and out of its lane. The officer lost sight of the vehicle's tail lights and began to slow down. When the officer entered the turn, he saw the wrecked vehicle. Brothers Robert Dewayne Davies, 36, and 38-year-old Ernest Shawn Davies were killed.",Unreported,Vehic/Purs,http://www.wistv.com/Global/story.asp?s=11800848&clienttype=printable,No,,,,19213
19214,Ernest Shawn Davies,38,Male,European-American/White,European-American/White,Not imputed,https://www.fatalencounters.org/wp-content/uploads/2013/10/ErnestShawnDavies.jpg,01/09/2010,South Paraham Rd.,Clover,SC,29710,York,South Paraham Rd. Clover SC 29710 York,35.0750047,-81.1545079,Clover Police Department,Vehicle,,,,,,,,,"An officer spotted a speeding truck. The truck didn't stop when the officer turned on blue lights and a siren. As they approached Clover High School, the vehicle started swerving in and out of its lane. The officer lost sight of the vehicle's tail lights and began to slow down. When the officer entered the turn, he saw the wrecked vehicle. Brothers Robert Dewayne Davies, 36, and 38-year-old Ernest Shawn Davies were killed.",Unreported,Vehic/Purs,http://www.wistv.com/Global/story.asp?s=11800848&clienttype=printable,No,,,,19214
19277,Sylvia Britt Mattox Hill,47,Female,European-American/White,European-American/White,Not imputed,,01/08/2010,1600 block Potato House Road,Darlington,SC,29532,Darlington,1600 block Potato House Road Darlington SC 29532 Darlington,34.2488658,-79.9378922,South Carolina Highway Patrol,Vehicle,,,,,,,,,"Hill led a S.C. Highway Patrol trooper on a high-speed chase that ended when his 2005 Chevy Cobalt ran into a tree and killed his only passenger, his 47-year-old wife Sylvia Britt Mattox Hill.",Criminal,Vehic/Purs,http://www.scnow.com/news/local/article_bc4fd117-d4e1-5a1a-b871-943211f8846e.html,Drug or alcohol use,,,,19277
19100,Robert White Jr.,23,Male,Race unspecified,African-American/Black,0.861221777,,11/07/2009,SC-45,McClellanville,SC,29458,Charleston,SC-45 McClellanville SC 29458 Charleston,33.095336,-79.4762034,Charleston County Sheriff's Office,Vehicle,,,,,,,,,"The driver, Robert White Jr., 23, of Huger and passenger, Marcus Taylor, 27, of Goose Creek were pronounced dead after a high-speed chase that began with gunfire outside a club and ended when the driver lost control on a country road and crashed into a tree.",Unreported,Vehic/Purs,http://www.postandcourier.com/news/killed-in-crash-of-fleeing-vehicle/article_19d523d8-54bc-52e7-afc5-1dcbfd60dc80.html,No,,,,19100
19101,Marcus Ryan Taylor,27,Male,Race unspecified,African-American/Black,0.862752109,,11/07/2009,SC-45,McClellanville,SC,29458,Charleston,SC-45 McClellanville SC 29458 Charleston,33.095336,-79.4762034,Charleston County Sheriff's Office,Vehicle,,,,,,,,,"The driver, Robert White Jr., 23, of Huger and passenger, Marcus Taylor, 27, of Goose Creek were pronounced dead after a high-speed chase that began with gunfire outside a club and ended when the driver lost control on a country road and crashed into a tree.",Unreported,Vehic/Purs,http://www.postandcourier.com/news/killed-in-crash-of-fleeing-vehicle/article_19d523d8-54bc-52e7-afc5-1dcbfd60dc80.html,No,,,,19101
19102,Steven M. Satterfield Jr.,45,Male,European-American/White,European-American/White,Not imputed,,10/22/2009,335 Harrell Drive,Spartanburg,SC,29307,Spartanburg,335 Harrell Drive Spartanburg SC 29307 Spartanburg,34.9764099,-81.8576333,Spartanburg County Sheriff's Office,Gunshot,,,,,,,,,Steven M. Satterfield Jr. was shot and killed during a domestic disturbance in which the neighbor called police. News media did not say what precipitated the call or the shooting.,Unreported,Deadly force,http://www.goupstate.com/article/20091023/ARTICLES/910231036,Unknown,,,,19102
8527,Trevor Varinecz,16,Male,European-American/White,European-American/White,Not imputed,http://www.firstgiving.com/imaging/stock/85c9e94d-fed2-43a7-b34a-44288d75aed7.jpg/500,10/16/2009,700 Gardner Lacy Road,Myrtle Beach,SC,29579,Horry,700 Gardner Lacy Road Myrtle Beach SC 29579 Horry,33.779568,-78.9706484,Horry County Police Department,Gunshot,,,,,,,,,"With a high-functioning form of Asperger's syndrome, the mental stability of Varinecz declined when his individual mentoring time at school was cut from 900 hours to 45 hours per week. He ended up stabbing a school resource officer seven times with a WWII bayonet, who shot him dead in self-defense. Evidence suggested a deliberate suicide. The family's wrongful death suit was settled for $175K.",Justified,Deadly force,http://www.wmbfnews.com/story/20111483/sro-seeks-end-to-trevor-varinecz-lawsuit,Yes,,,,8527
19103,Christopher James Campbell,28,Male,European-American/White,European-American/White,Not imputed,https://www.fatalencounters.org/wp-content/uploads/2013/10/ChristopherCampbell.jpg,10/03/2009,N Maple St & Wassamassaw Rd,Summerville,SC,29483,Dorchester,N Maple St & Wassamassaw Rd Summerville SC 29483 Dorchester,33.0367838,-80.1865228,Summerville Police Department,Gunshot,,,,,,,,,Christopher James Campbell was driving a gray Honda when an officer pulled him over for not wearing a seat belt. The car slid into a ditch. Campbell allegedly got out of the car with a gun in his hand and was shot and killed.,Unreported,Deadly force,http://www.postandcourier.com/news/police-man-refused-to-drop-handgun/article_8e6091a6-b629-5785-a81e-29338c93c83a.html,No,,,,19103
19104,Velyncia Bradford,46,Female,Race unspecified,African-American/Black,0.686961181,,10/02/2009,US-17 ALT,Moncks Corner,SC,29461,Berkeley,US-17 ALT Moncks Corner SC 29461 Berkeley,33.2021329,-79.990409,Berkeley County Sheriff's Office,Vehicle,,,,,,,,,"Velyncia Bradford, 46, was crossing the highway in town on foot when a north-bound cruiser driven by Deputy Charles Scott hit and killed her. Scott is a reserve officer.",Cleared,Vehic/Purs,http://www.postandcourier.com/apps/pbcs.dll/article?avis=CP&date=20091003&category=PC16&lopenr=310039998&Ref=AR,No,,,,19104
19105,Name withheld by police,44,Male,European-American/White,European-American/White,Not imputed,,09/24/2009,,,SC,,Spartanburg,SC Spartanburg,34.9495672,-81.9320482,Spartanburg County Sheriff's Office,Gunshot,,,,,,,,,"A 44-year old white male died on 9-24-09 in Spartanburg. The Spartanburg Sheriff's Office was involved, but details regarding the circumstances of the death are unknown. The medical cause of death was contact wound to head from an unspecified firearm and the manner of death was suicide. Source: South Carolina Deaths in Police Custody, 2009 - 2010",Suicide,Suicide,https://drive.google.com/file/d/0B-l9Ys3cd80fdEFIYXhsVmNXTjA/view?usp=sharing,Unknown,,,,19105
19106,Robert Lee Thompson,29,Male,African-American/Black,African-American/Black,Not imputed,,09/19/2009,Clemson Boulevard and West Beltline Boulevard,Anderson,SC,29621,Anderson,Clemson Boulevard and West Beltline Boulevard Anderson SC 29621 Anderson,34.5494713,-82.6742823,Anderson Police Department,Asphyxiated/Restrained,,,,,,,,,Robert Lee Thompson lost consciousness due to a chokehold being placed on him during a struggle with Officer Bradley Small after a routine traffic stop. The car was reportedly stopped for a broken tail light. Thompson reportedly had warrants issued for his arrest.,Cleared,Less-than-lethal force,https://docs.google.com/document/d/1jedWmx9mpJPdANkZdDKWP15HCXMN96PB8akaXexnjFo/edit?usp=sharing,No,,,,19106
19107,Jason Wayne Strickland,32,Male,Race unspecified,African-American/Black,0.508917388,,08/23/2009,500 Wildlife Parkway,Columbia,SC,29210,Richland,500 Wildlife Parkway Columbia SC 29210 Richland,34.0090964,-81.0731693,"Lexington County Sheriff's Department, Columbia Police Department, Richland County Sheriff's Office",Gunshot,,,,,,,,,"Lisa Marie Bacon was shot in the head with a handgun by her live-in boyfriend, identified as 32-year-old Jason Wayne Strickland. Investigators believe Strickland rolled Bacon's body up in a sheet, and placed it in the back of his pick-up truck. Officials say they received a call about his reckless driving and chased him until he stopped at the Saluda River near the Riverbanks Zoo. Officers from the Lexington County Sheriff's Department, Columbia Police Department and Richland County Sheriff's Department found Strickland in the parking lot where he abandoned his truck and started walking toward the Saluda River. Despite verbal commands that he return to officers, authorities say Strickland then killed himself in the river.",Suicide,Suicide,http://www.wistv.com/story/10976589/police-called-to-gilbert-home-before-murder-suicide?clienttype=printable,No,,,,19107
8361,Ernest Ridlehuber,53,Male,Race unspecified,European-American/White,0.989332604,,08/12/2009,4424 Old Laurens Greenwood Hwy,Greenwood,SC,29649,Greenwood,4424 Old Laurens Greenwood Hwy Greenwood SC 29649 Greenwood,34.283515,-82.117337,Greenwood County Sheriff's Office,Tasered,,,,,,,,,"Family members had reported Ridlehuber as missing, and family members reportedly accompanied county officers when he was found at a friend's house. Ridlehuber became violently resistant and combative, was tasered multiple times, and died shortly afterward.",Unreported,Less-than-lethal force,http://www.wrdw.com/home/headlines/53129892.html?site=mobile,No,,,,8361
19108,Tiraneka Shanese Jenkins,26,Female,African-American/Black,African-American/Black,Not imputed,https://fatalencounters.org/wp-content/uploads/2020/03/7-10-2008-Tiraneka-Shanese-Jenkins.jpg,07/10/2009,114 Spring St,Charleston,SC,29403,Charleston,114 Spring St Charleston SC 29403 Charleston,32.7903411,-79.9475684,Charleston Police Department,Gunshot,,,,,,,,,"Tiraneka Jenkins was shot by a Charleston Police officer outside of a downtown bar. Officer Christopher Simmons shot Jenkins outside Frankie's Cafe after she refused to drop a gun. Simmons and other officers were responding to a reported domestic dispute at the bar, police said.",Unreported,Deadly force,http://www.wach.com/news/story.aspx?id=324721#.VWQLomTBzGc,No,,,,19108
19109,Steven Wayne Branham,41,Male,Race unspecified,European-American/White,0.756152765,,07/04/2009,4315 SC-917,Loris,SC,29569,Horry,4315 SC-917 Loris SC 29569 Horry,34.101389,-79.0124,Horry County Police Department,Gunshot,,,,,,,,,"Steven Wayne Branham was wanted in connection with a robbery in Little River. After a chase, he allegedly committed suicide in a cornfield near Conway.",Suicide,Suicide,https://docs.google.com/document/d/1AJOnzFXniJJKjdqtJT1XsmBtKCKFVl3_y_rzNR5g1a8/edit?usp=sharing,No,,,,19109
19110,Teresa Lynn Blankenship,35,Female,European-American/White,European-American/White,Not imputed,,07/02/2009,Chesnee Highway and Cherokee National Highway,Gaffney,SC,29341,Cherokee,Chesnee Highway and Cherokee National Highway Gaffney SC 29341 Cherokee,35.1144528,-81.7055994,Cherokee County Sheriff's Office,Gunshot,,,,,,,,,"Blanton said Blankenship was driving a dark S-10 Chevrolet Blazer when police attempted to pull over the vehicle. Two juveniles got out of the vehicle with their hands up, but Blankenship fled. Ten to 15 cars chased Blankenship, and shots were fired from her vehicle. She ended the chase with a self-inflicted fatal gunshot. Police said narcotics were found in Blankenship's vehicle.",Suicide,Suicide,https://drive.google.com/file/d/0B-l9Ys3cd80fdEFIYXhsVmNXTjA/view?usp=sharing,No,,,,19110
19111,Timmy Ray Fulmore,42,Male,Race unspecified,African-American/Black,0.682501077,,07/02/2009,SC-544 and Singleton Ridge Rd,Conway,SC,29526,Horry,SC-544 and Singleton Ridge Rd Conway SC 29526 Horry,33.7768351,-79.021139,Horry County Police Department,Vehicle,,,,,,,,,"Horry County police officer Ricky Ruggerio was traveling about 57 miles per hour in a 45 mile-per-hour zone at the time of the crash. The driver of the other vehicle, Pamela Hunt, failed to yield the right of way, police said. Timmy Fulmore, a 42-year-old corrections officer from Orrum, N.C., was a passenger in Hunt's vehicle and was pronounced dead at the scene. Neither driver was charged.",Cleared,Vehic/Purs,https://docs.google.com/document/d/1BmEYfZtgAdmtTQt-Vl6o9eLaTl-IrPgqNK3LJgX2kgA/edit?usp=sharing,No,,,,19111
19112,Jelani Edwards,30,Male,African-American/Black,African-American/Black,Not imputed,,07/01/2009,Sheraton Dr & State Hwy 1483,Beech Island,SC,29842,Aiken,Sheraton Dr & State Hwy 1483 Beech Island SC 29842 Aiken,33.4213029,-81.8823115,Jackson Police Department,Gunshot,,,,,,,,,"Jelani Edwards was said to be one of three men who held up the First Citizens Bank on Atomic Road in Jackson. They received a bag of money and then took off in a burgundy vehicle, that was later reported stolen out of Georgia, and sped toward Beech Island on Old Jackson Highway. A Jackson police officer chased the speeding vehicle into Beech Island. The driver lost control and wrecked. All three suspects exited the vehicle, and Edwards reportedly pulled a handgun from his waistband and shot at a Jackson police officer. The officer returned fire, killing Edwards.",Unreported,Deadly force,http://www.aikenstandard.com/news/update-coroner-says-suspect-who-was-killed-was-aiming-at/article_76846c26-2536-5443-8757-bd81c1df6bc7.html,No,,,,19112
19113,Martin Jarrett,36,Male,Race unspecified,European-American/White,0.58386128,,06/26/2009,130 Railroad St.,Warrenville,SC,29851,Aiken,130 Railroad St. Warrenville SC 29851 Aiken,33.5028547,-81.8740869,"South Carolina Law Enforcement Division, Columbia County (Ga.) Sheriff's Office, Richmond County Sheriff's Office (Ga.), Aiken County Sheriff's Office",Gunshot,,,,,,,,,"Martin Jarrett was having an argument with his girlfriend at a bar when she called police. After a standoff, he shot and killed himself.",Suicide,Suicide,https://docs.google.com/document/d/15tIcef1TA_g_-F8AjJvczLql4dtH2DZMOqirR94-V-c/edit?usp=sharing,No,,,,19113
19114,Name withheld by police,43,Male,European-American/White,European-American/White,Not imputed,,06/16/2009,,Mauldin,SC,29662,Greenville,Mauldin SC 29662 Greenville,34.7817994,-82.3044871,,Gunshot,,,,,,,,,"A 43-year old white male died at the scene in Mauldin on 6/16/09 after threatening or assaulting one or more law enforcement officers with a weapon (probably a handgun). The medical cause of death was gunshot wound to the head and the manner of death was suicide. Source: South Carolina Deaths in Police Custody, 2009 - 2010",Suicide,Suicide,https://drive.google.com/file/d/0B-l9Ys3cd80fdEFIYXhsVmNXTjA/view?usp=sharing,Unknown,,,,19114
19115,Omar Donta Adams,31,Male,Race unspecified,African-American/Black,0.515174915,,06/10/2009,503 Willow St.,Gaffney,SC,29340,Cherokee,503 Willow St. Gaffney SC 29340 Cherokee,35.074497,-81.637776,Gaffney Police Department,Medical emergency,,,,,,,,,"Gaffney police responded to Adams' home in response to a domestic violence situation. After being handcuffed, Omar D. Adams, 31, ran about 100 feet and then collapsed and died, police said.",Unreported,No,http://www.goupstate.com/article/20090611/articles/906119974,Unknown,,,,19115
19116,Yvette Williams,15,Female,African-American/Black,African-American/Black,Not imputed,https://fatalencounters.org/wp-content/uploads/2020/02/6-4-2009-Yvette-Williams.jpg,06/04/2009,732 E Main St.,Rock Hill,SC,29730,York,732 E Main St. Rock Hill SC 29730 York,34.919343,-81.014087,Rock Hill Police Department,Gunshot,,,,,,,,,"According to police, Yvette Williams allegedly robbed the Park Grocery store. When the officers arrived on the scene, they assumed Williams had a 9mm gun since that's what the 911 caller told police. Of the 11 shots fired by the two police officers, 3 of the shots actually hit Williams. They later learned she actually had a BB gun.",Justified,Deadly force,http://www.wistv.com/story/10511033/police-video-shows-teen-pointed-gun-in-rock-hill-shooting,No,,,,19116
19117,David Preston Wood,45,Male,Race unspecified,European-American/White,0.924737179,,05/17/2009,1121 Gap Creek Road,Lyman,SC,29365,Spartanburg,1121 Gap Creek Road Lyman SC 29365 Spartanburg,34.957786,-82.176041,"Spartanburg County Sheriff's Office, Greer Police Department",Gunshot,,,,,,,,,"David Preston Wood killed himself following a police chase that began after a domestic dispute, police said.",Suicide,Suicide,https://docs.google.com/document/d/1CtyegIKm9kXrbowMsR3NPc8J6uFfE9B-OxBpm27adkA/edit?usp=sharing,No,,,,19117
19118,Bret Hill Allen,46,Male,Race unspecified,European-American/White,0.60474521,,05/16/2009,SC-544 and West Cox Ferry Road,Conway,SC,29526,Horry,SC-544 and West Cox Ferry Road Conway SC 29526 Horry,33.8040842,-79.0185374,Horry County Police Department,Vehicle,,,,,,,,,"Bret Allen, 46, was killed when a Honda Accord pulled out of an apartment complex and crashed with the motorcycle he was driving while he was being chased by a Horry County police officer for speeding.",Unreported,Vehic/Purs,https://docs.google.com/document/d/1iKnmrYjuO_E9QExgLnoq2GDyYCfCKHelioBOuiQbRXw/edit?usp=sharing,No,,,,19118
19119,Jordan Renaldo Smith,22,Male,Race unspecified,European-American/White,0.754336602,,05/03/2009,Heckle Blvd and Wade Hampton Blvd,Rock Hill,SC,29732,York,Heckle Blvd and Wade Hampton Blvd Rock Hill SC 29732 York,34.9554647,-81.0669821,Lancaster County Sheriff's Office,Vehicle,,,,,,,,,"Two people, including a Lancaster County sheriff's office Sgt. Stacey Roberts, 40, and Jordan Smith, 22, died Sunday when the deputy's motorcycle crashed into a car on Heckle Boulevard, police said.",Unreported,Vehic/Purs,https://docs.google.com/document/d/1tySY0QsSDT6p73TMg107BKunJJLkQD1eeRLQxJQxjK8/edit?usp=sharing,No,,,,19119
19120,Name withheld by police,47,Male,Race unspecified,Race unspecified,Race not determined,,03/16/2009,Gardner Street,Camden,SC,29020,Kershaw,Gardner Street Camden SC 29020 Kershaw,34.2468152,-80.5876645,Kershaw County Sheriff's Office,Gunshot,,,,,,,,,"A man shot himself with a rifle he stole from a Kershaw County sheriff's deputy's patrol car that was stopped at a gas station near Camden, police said.",Unreported,Deadly force,https://docs.google.com/document/d/1mh4mH7YQgmat7fQJT-n1OJBKRYU-lj9X66mWskaB10s/edit?usp=sharing,No,,,,19120
19121,Name withheld by police,,Male,Race unspecified,Race unspecified,Race not determined,,02/10/2009,Marc Lane,Liberty,SC,29657,Pickens,Marc Lane Liberty SC 29657 Pickens,34.7554523,-82.6488196,Pickens County Sheriff's Office,Gunshot,,,,,,,,,"Deputies surrounded a house because of a 911 call. A woman came out distraught saying a man was threatening to hurt himself. Negotiators tried to talk to him, but he shot and killed himself.",Suicide,Suicide,https://docs.google.com/document/d/1-tncgdismUB49GHqs4D4MKAxCFBd3ALjd260aJmeDEI/edit?usp=sharing,Yes,,,,19121
19122,James Clinton Brooks,30,Male,Race unspecified,European-American/White,0.639047805,,01/29/2009,West Main Street,Taylors,SC,29687,Greenville,West Main Street Taylors SC 29687 Greenville,34.9195595,-82.3073928,Greenville County Sheriff's Office,Vehicle,,,,,,,,,"A deputy was chasing a DUI suspect on Main Street in Taylors, when the suspect crossed the centerline and hit another vehicle head-on. The suspect was killed, the two passengers in the other vehicle were not seriously injured.",Unreported,Vehic/Purs,https://docs.google.com/document/d/1TZMrwwxPBF1Yr6e2xcobKYw834NqQy4u7A1TyGgYyEA/edit?usp=sharing,Drug or alcohol use,,,,19122
7807,Rodney Hamilton Jr.,26,Male,African-American/Black,African-American/Black,Not imputed,,01/23/2009,3108 Whiskey Road,Aiken,SC,29803,Aiken,3108 Whiskey Road Aiken SC 29803 Aiken,33.493476,-81.7006532,Aiken County Sheriff's Office,Gunshot,,,,,,,,,"At 4:30 a.m. Hamilton lay in wait for a convenience store clerk to open the doors, then took her hostage at gunpoint. One of the two responding deputies emerged from the resulting firefight with life-threatening wounds. The clerk was unhurt. Hamilton was shot dead.",Justified,Deadly force,http://www.thestate.com/news/local/crime/article14338802.html,No,,,,7807
7686,William Dean Pruitt,30,Male,Race unspecified,European-American/White,0.750346494,,12/06/2008,217 Longhorn Drive,Chesnee,SC,29323,Spartanburg,217 Longhorn Drive Chesnee SC 29323 Spartanburg,35.049923,-81.9150345,Spartanburg County Sheriff's Office,Gunshot,,,,,,,,,"In an incident ""still strewn with question marks"" deputies responding to a complaint from a mobile home park that one man had pulled a gun on another. The armed man was Pruitt, with a patchy and long criminal history. He reported opened fire on the officers and was shot dead in return.",Unreported,Deadly force,http://www.blueridgenow.com/article/20081208/news/812080283,No,,,,7686
19067,James Ellie Brogden,67,Male,European-American/White,European-American/White,Not imputed,https://fatalencounters.org/wp-content/uploads/2019/12/James-Brogden-.jpg,11/29/2008,Pleasant School Road,Gaffney,SC,29341,Cherokee,Pleasant School Road Gaffney SC 29341 Cherokee,35.1253807,-81.6297889,Cherokee County Sheriff's Office,Vehicle,,,,,,,,,"James Ellie Brogden died after Aaron Christopher Saunders used a Case 821 front-end loader with a forklift appendage to hoist a 2005 Toyota and drop the vehicle on Brogden, police said. Police then shot and killed Saunders.",Cleared,Vehic/Purs,http://freerepublic.com/focus/news/2140806/posts,No,,,,19067
19068,Aaron Christopher Saunders,28,Male,European-American/White,European-American/White,Not imputed,,11/29/2008,Pleasant School Road,Gaffney,SC,29341,Cherokee,Pleasant School Road Gaffney SC 29341 Cherokee,35.1253807,-81.6297889,Cherokee County Sheriff's Office,Gunshot,,,,,,,,,"James Ellie Brogden died after Aaron Christopher Saunders used a Case 821 front-end loader with a forklift appendage to hoist a 2005 Toyota and drop the vehicle on Brogden, police said. Police then shot and killed Saunders.",Justified,Deadly force,http://www.gaffneyledger.com/news/2008-12-01/obits/021.html,No,,,,19068
19063,Darrell Weathers,26,Male,Race unspecified,African-American/Black,0.622903381,,11/06/2008,314 Maplewood Drive,Moncks Corner,SC,29461,Berkeley,314 Maplewood Drive Moncks Corner SC 29461 Berkeley,33.154796,-80.038478,Berkeley County Sheriff's Office,Gunshot,,,,,,,,,Darrell Weathers was wanted for shooting Bridget Gourdine. He shot and killed himself as Sheriff's Sgt. Kevin McField approached a mobile home he'd broken into.,Suicide,Suicide,http://www.postandcourier.com/news/hiding-suspect-shoots-kills-self/article_6cb1e2c2-b219-52e2-8ede-55353e2b3c82.html,No,,,,19063
19279,Begondae Moore,27,Male,African-American/Black,African-American/Black,Not imputed,,11/05/2008,2060 Sam Rittenberg Blvd,Charleston,SC,29407,Charleston,2060 Sam Rittenberg Blvd Charleston SC 29407 Charleston,32.7921835,-80.0311071,U.S. Immigration and Customs Enforcement,Gunshot,,,,,,,,,"Begondae Moore died at a medical facility on 11/6/08 after apparently being shot during a robbery attempt at a Charleston shopping mall parking lot. A U.S. Immigration and Customs Enforcement agent, who happened to be nearby, intervened and reportedly fired several shots during the incident. However, it has not yet been determined if he struck anyone at the scene.",Unreported,Deadly force,http://www.postandcourier.com/news/deadly-gunfire-at-mall/article_4febf03b-29c5-5d07-8b3f-983d821a2937.html,No,,,,19279
19069,Nicole L. Miller,34,Female,Race unspecified,European-American/White,0.969547251,,09/10/2008,SC-183 & Dacusville Hwy,Easley,SC,29640,Pickens,SC-183 & Dacusville Hwy Easley SC 29640 Pickens,34.8831907,-82.6031868,Easley Police Department,Vehicle,,,,,,,,,"Nicole L. Miller, 34, died when she attempted to elude police and crashed head-on with the oncoming car of Breton ""Brent"" J. Winchester, 38, of Easley. Winchester was also killed. Police were attempting to stop Miller to question her about keeping the car of a woman for whom she had gone to pick up pizza. When Miller didn't return after three hours, police were called.",Unreported,Vehic/Purs,http://archive.upstatetoday.com/?p=30739,No,,,,19069
19070,"Breton ""Brent"" J. Winchester",38,Male,Race unspecified,European-American/White,0.955821255,,09/10/2008,SC-183 & Dacusville Hwy,Easley,SC,29640,Pickens,SC-183 & Dacusville Hwy Easley SC 29640 Pickens,34.8831907,-82.6031868,Easley Police Department,Vehicle,,,,,,,,,"Nicole L. Miller, 34, died when she attempted to elude police and crashed head-on with the oncoming car of Breton ""Brent"" J. Winchester, 38, of Easley. Winchester was also killed. Police were attempting to stop Miller to question her about keeping the car of a woman for whom she had gone to pick up pizza. When Miller didn't return after three hours, police were called.",Unreported,Vehic/Purs,http://archive.upstatetoday.com/?p=30739,No,,,,19070
