25002,Name withheld by police,,Male,Race unspecified,Race unspecified,Race not determined,,10/18/2018,2200 block Vance Rd,Vance,SC,29163,Orangeburg,2200 block Vance Rd Vance SC 29163 Orangeburg,33.425234,-80.4826576,Orangeburg County Sheriff's Office,Gunshot,,,Armed,Firearm/Gun,Self-inflicted injury,Not fleeing,,,"At 4 p.m., deputies arrived at a where they saw a woman sitting in a chair holding her left arm in the air. The woman's son told deputies that she'd been shot. The woman told deputies that her boyfriend, who had shot her, was still on the property, but she wasn't sure of his exact location. As police searched for the woman's boyfriend at the rear of the residence, a deputy reported seeing him in a nearby wooded area and a pond. Police said he shot and killed himself as they approached.",Suicide,Suicide,https://thetandd.com/news/local/crime-and-courts/report-man-shot-vance-woman-killed-self/article_79128ba5-c02d-5429-9ba3-ae6bd2e63cc7.html,No,,,,25002
14412,Timothy W. Roberts,44,Male,Race unspecified,African-American/Black,0.744216839,,10/15/2018,3483 Charleston Hwy,West Columbia,SC,29172,Lexington,3483 Charleston Hwy West Columbia SC 29172 Lexington,33.9042544,-81.0644047,Lexington County Sheriff's Department,Vehicle,,,Unarmed,None,None,Fleeing/Vehicle,,,"Timothy W. Roberts, 44, and Nicole Y. Beran, 39, were in a stolen vehicle being pursued by the Lexington County Sheriff's Department when they collided with a commercial delivery vehicle, killing them.",Unreported,Pursuit,https://wsbt.com/news/local/update-prosecutors-office-names-man-killed-in-st-joseph-co-police-chase,No,,,,14412
25040,Nicole Yoshiko Beran,39,Female,European-American/White,European-American/White,Not imputed,https://www.fatalencounters.org/wp-content/uploads/2018/11/Nicole-Yoshiko-Beran.jpg,10/15/2018,3483 Charleston Hwy,West Columbia,SC,29172,Lexington,3483 Charleston Hwy West Columbia SC 29172 Lexington,33.9042544,-81.0644047,Lexington County Sheriff's Department,Vehicle,,,Unarmed,None,None,Fleeing/Vehicle,,,"Timothy W. Roberts, 44, and Nicole Y. Beran, 39, were in a stolen vehicle being pursued by the Lexington County Sheriff's Department when they collided with a commercial delivery vehicle, killing them.",Unreported,Pursuit,https://www.thestate.com/news/local/crime/article220042810.html,No,,,,25040
24921,Joseph Dawson,24,Male,Race unspecified,European-American/White,0.616680525,,09/28/2018,1100 block Walden C Jones Rd,Johns Island,SC,29455,Charleston,1100 block Walden C Jones Rd Johns Island SC 29455 Charleston,32.7451296,-80.1254553,Charleston County Sheriff's Office,Gunshot,,,Armed,Firearm/Gun,Used weapon,Not fleeing,,,"At 10:09 a.m. Joseph Dawson's wife called 911 to report her husband was threatening her and other family members. When deputies encountered Dawson at his residence, he drew a gun, and one deputy took him down to the ground, and a struggle began. Dawson got off several shots, and another deputy shot and killed Dawson.",Pending investigation,Deadly force,https://www.live5news.com/2018/09/28/dispatch-deputies-responding-reported-shots-fired-johns-island/,No,,,,24921
24891,Nicolette Green,43,Female,European-American/White,European-American/White,Not imputed,https://www.fatalencounters.org/wp-content/uploads/2018/09/Nicolette-Green.jpg,09/18/2018,US-76,Nichols,SC,29581,Horry,US-76 Nichols SC 29581 Horry,34.225892,-79.13448,Horry County Sheriff's Office,Drowned,,,Unarmed,None,None,Not fleeing,,,"Nicolette Green, 43, and Wendy Newton, 45, drowned when the deputy-driven van they were riding in was overwhelmed by high waters caused by Hurricane Florence. They were on their way to a mental health facility and were wearing handcuffs. The deputies, Joshua Bishop and Stephen Flood, were not injured.",Pending investigation,No,https://www.nytimes.com/2018/09/19/us/women-drown-van-south-carolina-floods.html?partner=rss&emc=rss,Yes,,,,24891
24893,Wendy Newton,45,Female,European-American/White,European-American/White,Not imputed,https://www.fatalencounters.org/wp-content/uploads/2018/09/WendyNewton.jpg,09/18/2018,US-76,Nichols,SC,29581,Horry,US-76 Nichols SC 29581 Horry,34.225892,-79.13448,Horry County Sheriff's Office,Drowned,,,Unarmed,None,None,Not fleeing,,,"Nicolette Green, 43, and Wendy Newton, 45, drowned when the deputy-driven van they were riding in was overwhelmed by high waters caused by Hurricane Florence. They were on their way to a mental health facility and were wearing handcuffs. The deputies, Joshua Bishop and Stephen Flood, were not injured.",Pending investigation,No,https://www.nytimes.com/2018/09/19/us/women-drown-van-south-carolina-floods.html?partner=rss&emc=rss,Yes,,,,24893
24772,Lloyd Michael Dove,56,Male,Race unspecified,European-American/White,0.734914763,,08/27/2018,Jolly Drive and SC 49,Union,SC,29379,Union,Jolly Drive and SC 49 Union SC 29379 Union,34.7363056,-81.5501318,Union County Sheriff's Office,Gunshot,,,Armed,Firearm/Gun,Self-inflicted injury,Not fleeing,,,"Lloyd Dove was a suspect in multiple armed robberies, when he was stopped by deputies. He allegedly shot and killed himself before police approached the vehicle.",Suicide,Suicide,https://www.uniondailytimes.com/news/17590/suspects-death-under-investigation,No,,,,24772
24763,Stephanie Nicole Bolton Owens,41,Female,European-American/White,European-American/White,Not imputed,https://fatalencounters.org/wp-content/uploads/2020/04/8-26-2018-Stephanie-Owens.jpg,08/26/2018,547 Bear Creek Road,Blacksburg,SC,29702,Cherokee,547 Bear Creek Road Blacksburg SC 29702 Cherokee,35.0615086,-81.52198,Cherokee County Sheriff's Office,Gunshot,,,Armed,Firearm/Handgun,Brandished weapon,Not fleeing,,,"Deputies responded around 3:34 a.m. after Stephanie Owens called 911 and gave dispatchers accounts of events taking place in the home. When deputies arrived, Owens was seen with two guns in her hand as she paced in and out of her home, threatening to harm herself and deputies, police said. When she activated the laser sight on a weapon, four of the five responding deputies shot and killed her.",Pending investigation,Deadly force,https://www.gaffneyledger.com/articles/estate-of-woman-killed-by-officers-seeks-1-million/,No,,,,24763
24752,Jeffery Paul Fabio,44,Male,European-American/White,European-American/White,Not imputed,https://fatalencounters.org/wp-content/uploads/2020/04/8-24-2018-Jeffery-Paul-Fabio.jpg,08/24/2018,2998 Grace Chapel Rd,Enoree,SC,29335,Spartanburg,2998 Grace Chapel Rd Enoree SC 29335 Spartanburg,34.6903139,-81.8338407,Spartanburg County Sheriff's Office,Gunshot,,,Armed,Edged weapon/Crossbow,Brandished weapon,Not fleeing,,,"Deputies were investigating a report about a woman's estranged husband who had come to her home and sexually assaulted her and was armed with a crossbow . After sending the woman, who called from a neighbor's house, to the hospital, deputies encountered the the estranged husband, Jeffrey Paul Fabio, in front of his wifes home with the crossbow. After a 15-minute standoff, during which Fabio asked deputies to kill him and disobeyed orders to put the crossbow down, deputies shot and killed him.",Pending investigation,Deadly force,https://www.wspa.com/news/man-with-crossbow-who-was-shot-killed-by-deputies-in-enoree-idd/,No,,,,24752
24624,Braeden Scott Rankin,23,Male,European-American/White,European-American/White,Not imputed,https://www.fatalencounters.org/wp-content/uploads/2018/08/Braeden-Scott-Rankin.jpeg,07/18/2018,US-221 and I-85,Spartanburg,SC,29307,Spartanburg,US-221 and I-85 Spartanburg SC 29307 Spartanburg,35.017891,-81.896904,Spartanburg County Sheriff's Office,Vehicle,,,Unarmed,None,None,Fleeing/Vehicle,,,"Deputies were called around 8:45 p.m. to a convenience store for reports of two people at the gas pumps who appeared to be engaged in drug activity. A vehicle backed out of the parking space and refused to stop when a deputy tried to pull the car over. The deputy pursued the vehicle for four minutes but reportedly canceled the pursuit when he lost sight of the vehicle. Another deputy saw the vehicle at about 9 p.m. on Highway 221. The deputy tried to stop the vehicle, but the vehicle fled and cut off its lights as it crossed over I-85. The vehicle ran a red light at an intersection and crashed head-on into a tractor trailer, killing driver Jordan Balkind, 23, and passenger, Braeden Rankin, 23.",Unreported,Pursuit,"https://www.foxcarolina.com/news/deputies-chase-in-spartanburg-co-led-to-deadly-crash-on-highway-221/article_715c942e-bf2f-56a5-92d1-0fb066128bd7.html#:~:text=The%20Spartanburg%20County%20coroner%20said,a%20chase%20on%20Wednesday%20night.&text=Coroner%20Rusty%20Clevenger%20said%20Braeden,a%20passenger%20in%20the%20car.",Drug or alcohol use,,,,24624
24625,Jordan Balkind,23,Male,Race unspecified,Race unspecified,Race not determined,,07/18/2018,US-221 and I-85,Spartanburg,SC,29307,Spartanburg,US-221 and I-85 Spartanburg SC 29307 Spartanburg,35.017891,-81.896904,Spartanburg County Sheriff's Office,Vehicle,,,Unarmed,None,None,Fleeing/Vehicle,,,"Deputies were called around 8:45 p.m. to a convenience store for reports of two people at the gas pumps who appeared to be engaged in drug activity. A vehicle backed out of the parking space and refused to stop when a deputy tried to pull the car over. The deputy pursued the vehicle for four minutes but reportedly canceled the pursuit when he lost sight of the vehicle. Another deputy saw the vehicle at about 9 p.m. on Highway 221. The deputy tried to stop the vehicle, but the vehicle fled and cut off its lights as it crossed over I-85. The vehicle ran a red light at an intersection and crashed head-on into a tractor trailer, killing driver Jordan Balkind, 23, and passenger, Braeden Rankin, 23.",Unreported,Pursuit,"https://www.foxcarolina.com/news/deputies-chase-in-spartanburg-co-led-to-deadly-crash-on-highway-221/article_715c942e-bf2f-56a5-92d1-0fb066128bd7.html#:~:text=The%20Spartanburg%20County%20coroner%20said,a%20chase%20on%20Wednesday%20night.&text=Coroner%20Rusty%20Clevenger%20said%20Braeden,a%20passenger%20in%20the%20car.",Drug or alcohol use,,,,24625
24472,Jethro Benjamin,68,Male,African-American/Black,African-American/Black,Not imputed,https://fatalencounters.org/wp-content/uploads/2020/03/7-14-2018-Jethro-Benjamin.jpg,07/14/2018,2671 Hospitality Blvd,Florence,SC,29501,Florence,2671 Hospitality Blvd Florence SC 29501 Florence,34.1873872,-79.8276951,Florence Police Department,Gunshot,,,Armed,Firearm/Handgun,Used weapon,Not fleeing,,,"Police responding to a report of a man waving a gun around encountered Jethro Benjamin brandishing a handgun. An officer ordered Benjamin to disarm and lay down on the ground. Instead Benjamin took cover behind a car and shot at the officer. The officer returned fire and wounded Benjamin, who died later in the hospital.",Pending investigation,Deadly force,https://www.wmbfnews.com/2019/01/10/florence-police-officer-cleared-deadly-july-shooting/,No,,,,24472
24423,Robert Eugene Gambrell III,33,Male,European-American/White,European-American/White,Not imputed,https://www.fatalencounters.org/wp-content/uploads/2018/07/Robert-Eugene-Gambrell-III.jpg,06/29/2018,826 Old Greenville Hwy,Clemson,SC,29631,Pickens,826 Old Greenville Hwy Clemson SC 29631 Pickens,34.7010064,-82.7977983,Clemson Police Department,Asphyxiated/Restrained,,,Unarmed,None,Struggled,Not fleeing,,,"Officers were called to a 7-Eleven around 2 a.m. for a fight at the gas station. By the time they arrived, Robert Eugene Gambrell had locked himself in the store and was destroying things inside. Police said the other person in the fight had been trying to help Gambrell with a motorcycle that would not start. When officers entered the store, Gambrell allegedly attacked them. He died after being handcuffed.",Pending investigation,Less-than-lethal force,https://www.foxcarolina.com/news/coroner-identifies-suspect-who-police-say-died-following-arrest-at-clemson-7-eleven/article_cf5668f9-32f1-5e7b-bafb-4e3527b16f87.html,No,,,,24423
24501,Damian Austin Bailey,21,Male,European-American/White,European-American/White,Not imputed,https://fatalencounters.org/wp-content/uploads/2020/02/5-20-2018-Damian-Bailey.jpg,05/20/2018,McNeely Road and River Road,Powdersville,SC,29673,Greenville,McNeely Road and River Road Powdersville SC 29673 Greenville,34.7840043,-82.4713035,Anderson County Sheriff's Office,Vehicle,,,Unarmed,None,None,Fleeing/Vehicle,,,"Around 8 a.m., a deputy attempted a traffic stop after seeing Damian Austin Bailey drive through a four-way stop. Police said the driver accelerated, and the deputy lost sight of the vehicle. When the deputy rounded a curve he saw that the vehicle had crashed. Bailey, 21, and Lyndsie Terressa Wright, 28, died after their vehicle ran off the road and hit a tree.",Unreported,Pursuit,https://www.independentmail.com/story/news/local/2018/05/20/troopers-investigating-powdersville-crash/626905002/,No,,,,24501
24503,Lyndsie Terressa Wright,28,Female,European-American/White,European-American/White,Not imputed,https://fatalencounters.org/wp-content/uploads/2020/02/5-20-2018-Lyndsie-Wright.jpg,05/20/2018,McNeely Road and River Road,Powdersville,SC,29673,Greenville,McNeely Road and River Road Powdersville SC 29673 Greenville,34.7840043,-82.4713035,Anderson County Sheriff's Office,Vehicle,,,Unarmed,None,None,Fleeing/Vehicle,,,"Around 8 a.m., a deputy attempted a traffic stop after seeing Damian Austin Bailey drive through a four-way stop. Police said the driver accelerated, and the deputy lost sight of the vehicle. When the deputy rounded a curve he saw that the vehicle had crashed. Bailey, 21, and Lyndsie Terressa Wright, 28, died after their vehicle ran off the road and hit a tree.",Unreported,Pursuit,https://www.independentmail.com/story/news/local/2018/05/20/troopers-investigating-powdersville-crash/626905002/,No,,,,24503
22060,Latrrio Kenya Singleton,37,Male,African-American/Black,African-American/Black,Not imputed,,04/14/2018,SC-45 and Gould Road,Pineville,SC,29468,Berkeley,SC-45 and Gould Road Pineville SC 29468 Berkeley,33.4359272,-80.1019666,Berkeley County Sheriff's Office,Vehicle,,,Unarmed,None,None,Fleeing/Vehicle,,,Latrrio K. Singleton was killed when he was ejected from a car he was driving on S.C. Hwy. 45 shortly before 11 p.m. Singleton allegedly had been driving nearly 120 mph immediately prior to the wreck while trying to evade a Berkeley County Sheriff's Office deputy.,Unreported,Pursuit,https://abcnews4.com/news/crime-news/man-killed-another-arrested-in-berkeley-county-high-speed-chase-rollover-crash,No,,,,22060
24185,Reshad Daloamir Davis,15,Male,African-American/Black,African-American/Black,Not imputed,https://fatalencounters.org/wp-content/uploads/2020/02/4-4-2018-Reshad-Daloamir-Davis.jpg,04/04/2018,Piney Grove Road and Linsbury Circle,Columbia,SC,29210,Richland,Piney Grove Road and Linsbury Circle Columbia SC 29210 Richland,34.0549418,-81.156002,Irmo Police Department,Vehicle,,,Unarmed,None,None,Fleeing/Vehicle,,,"Six teenagers in a stolen car fled police before they crashed, killing Travis Lamount Green Jr., 15, Travion D'Monte Green, 13, and Reshad Daloamir Davis, 15, died in the 9:30 p.m. crash. Police concluded Renas Davis, 18, was the driver of the stolen Pontiac G6. Davis was charged with three counts of failure to stop for blue lights resulting in death, failure to stop for blue lights resulting in great bodily harm, child endangerment and possession of a stolen motor vehicle valued under $10,000.",Criminal,Pursuit,http://wach.com/news/local/best-friend-remembers-irmo-student-killed-in-high-speed-chase,No,,,,24185
24186,"Travion ""Trey"" D'Monte Green",13,Male,African-American/Black,African-American/Black,Not imputed,https://fatalencounters.org/wp-content/uploads/2020/02/4-4-2018-Travion-Green.jpg,04/04/2018,Piney Grove Road and Linsbury Circle,Columbia,SC,29210,Richland,Piney Grove Road and Linsbury Circle Columbia SC 29210 Richland,34.0549418,-81.156002,Irmo Police Department,Vehicle,,,Unarmed,None,None,Fleeing/Vehicle,,,"Six teenagers in a stolen car fled police before they crashed, killing Travis Lamount Green Jr., 15, Travion D'Monte Green, 13, and Reshad Daloamir Davis, 15, died in the 9:30 p.m. crash. Police concluded Renas Davis, 18, was the driver of the stolen Pontiac G6. Davis was charged with three counts of failure to stop for blue lights resulting in death, failure to stop for blue lights resulting in great bodily harm, child endangerment and possession of a stolen motor vehicle valued under $10,000.",Criminal,Pursuit,http://wach.com/news/local/family-and-friends-trying-to-make-sense-of-things-after-teen-brothers-died-in-fatal-crash,No,,,,24186
24187,Travis Lamount Green Jr.,15,Male,African-American/Black,African-American/Black,Not imputed,https://fatalencounters.org/wp-content/uploads/2020/02/4-4-2018-Travis-Lamount-Green-Jr..jpg,04/04/2018,Piney Grove Road and Linsbury Circle,Columbia,SC,29210,Richland,Piney Grove Road and Linsbury Circle Columbia SC 29210 Richland,34.0549418,-81.156002,Irmo Police Department,Vehicle,,,Unarmed,None,None,Fleeing/Vehicle,,,"Six teenagers in a stolen car fled police before they crashed, killing Travis Lamount Green Jr., 15, Travion D'Monte Green, 13, and Reshad Daloamir Davis, 15, died in the 9:30 p.m. crash. Police concluded Renas Davis, 18, was the driver of the stolen Pontiac G6. Davis was charged with three counts of failure to stop for blue lights resulting in death, failure to stop for blue lights resulting in great bodily harm, child endangerment and possession of a stolen motor vehicle valued under $10,000.",Criminal,Pursuit,http://wach.com/news/local/family-and-friends-trying-to-make-sense-of-things-after-teen-brothers-died-in-fatal-crash,No,,,,24187
24184,Antwone L. Davenport Sr.,51,Male,Race unspecified,African-American/Black,0.76463916,,03/29/2018,Farrow Rd & Parklane Rd,Dentsville,SC,29203,Richland,Farrow Rd & Parklane Rd Dentsville SC 29203 Richland,34.0961412,-80.9625579,Richland County Sheriff's Department,Vehicle,,,Unarmed,None,None,Fleeing/Vehicle,,,"Police attempted to stop a vehicle around midnight. The driver sped away and was chased by a Richland County deputy. The chase ended after the vehicle crashed, flipping multiple times. Antwone L. Davenport was an unrestrained passenger who was ejected from the vehicle and killed. The driver's identity was withheld by police and was not immediately charged.",Unreported,Pursuit,http://www.wistv.com/story/37834894/coroner-identifies-columbia-man-killed-in-high-speed-chase-that-ended-in-a-crash,No,,,,24184
23989,Robert B. Shaw,29,Male,European-American/White,European-American/White,Not imputed,https://fatalencounters.org/wp-content/uploads/2020/02/3-28-201-Robert-B-Shaw.jpg,03/28/2018,I-26 & Old Dunbar Road,West Columbia,SC,29172,Lexington,I-26 & Old Dunbar Road West Columbia SC 29172 Lexington,33.93853,-81.086341,Lexington County Sheriff's Department,Gunshot,,,Armed,Firearm/Gun,Sudden threatening movement,Fleeing/Vehicle,,,"After a chase and a standoff, police attempted to take Robert Shaw into custody and shot and killed him when he moved.",Pending investigation,Deadly force,http://www.wltx.com/article/news/local/i-26-standoff-suspect-dead-traffic-starting-to-move-again/101-532787946,No,,,,23989
24183,Marcos Aguinaga,31,Male,Race unspecified,Hispanic/Latino,0.3494778,,03/26/2018,I-20 and Monticello Road,Columbia,SC,29203,Richland,I-20 and Monticello Road Columbia SC 29203 Richland,34.064863,-81.043436,Richland County Sheriff's Department,Vehicle,,,Unarmed,None,None,Fleeing/Vehicle,,,"A man and a woman were inside a Lowe's allegedly stealing items when employees flagged a deputy down. The pair allegedly ditched the stolen goods before entering a truck operated by a man. The three sped away. Police chased them. The alleged driver, Calvin Garrett Liabastre, 26, tried to drive through the fence that divides the interstate's westbound and eastbound lanes, disabling the vehicle. One of the fence posts came through the windshield and struck the front passenger, killing Marcos Aguinaga.",Criminal,Pursuit,http://www.wistv.com/story/37809979/schp-suspect-dead-driver-charged-in-i-20-crash,No,,,,24183
23972,Name withheld by police,,Male,Race unspecified,Race unspecified,Race not determined,,03/25/2018,424 Alma Byrd Lane,Spartanburg,SC,29301,Spartanburg,424 Alma Byrd Lane Spartanburg SC 29301 Spartanburg,34.9488536,-81.9523334,Spartanburg Police Department,Gunshot,,,Armed,Firearm/Gun,Self-inflicted injury,Not fleeing,,,"Officers were called to a home on Alma Byrd Lane for a disturbance between a man and a woman. The woman was released, but while officers were outside, they heard gunshots inside the home. Later, officers found the man dead from an apparent self-inflicted gunshot.",Suicide,Suicide,http://www.wspa.com/news/man-shoots-self-after-officers-called-for-disturbance-in-spartanburg-police-say/1076570103,No,,,,23972
23939,Jermaine Massey,35,Male,African-American/Black,African-American/Black,Not imputed,https://www.fatalencounters.org/wp-content/uploads/2018/03/Jermaine-Massey.jpg,03/19/2018,234 3rd Avenue,Greenville,SC,29609,Greenville,234 3rd Avenue Greenville SC 29609 Greenville,34.8681488,-82.4093426,Greenville County Sheriff's Office,Gunshot,,,Armed,Edged weapon/Knife,Advanced toward officer(s),Not fleeing,,,Deputies said Jermaine Massey charged at them with a knife after they responded to Massey's home for a reported disturbance. Massey was killed. Four Greenville County deputies were placed on leave.,Pending investigation,Deadly force,https://www.greenvilleonline.com/story/news/crime/2018/03/19/officer-involved-shooting-reported-near-poe-mill/440226002/,No,,,,23939
23826,Dustin James Case,20,Male,European-American/White,European-American/White,Not imputed,https://fatalencounters.org/wp-content/uploads/2020/01/2-27-2018-Justin-Case.jpg,02/27/2018,First Street and Saluda Street,Chester,SC,29706,Chester,First Street and Saluda Street Chester SC 29706 Chester,34.7171615,-81.1980066,"Chester County Sheriff's Office, Chester Police Department",Gunshot,,,Armed,Firearm/Handgun,Brandished weapon,Fleeing/Vehicle,,,"Police responded to a report of a stolen vehicle in the Richburg area around 10:30 p.m. A short while later, police saw the vehicle and initiated a chase that ended in a crash. Two officers, one Chester County deputy and a Chester Police officer, began approaching the vehicle after the crash when Dustin James Case turned and displayed what appeared to be a firearm. Both officers fired their service weapon, killing Case.",Pending investigation,Deadly force,http://www.wcnc.com/article/news/crime/one-killed-in-officer-involved-shooting-in-chester/275-523983840,No,,,,23826
3469,Trey Ta'Quan Pringle Sr.,24,Male,African-American/Black,African-American/Black,Not imputed,https://fatalencounters.org/wp-content/uploads/2020/01/2-17-2018-Trey-Pringle.jpg,02/17/2018,94 Detour Road,Seabrook,SC,29940,Beaufort,94 Detour Road Seabrook SC 29940 Beaufort,32.5171215,-80.7573445,Beaufort County Sheriff's Office,Tasered,,,Unarmed,None,Struggled,Not fleeing,,,"On Feb. 17, Trey Pringle's relative called 911 to report that Pringle was allegedly ""out of control, injured, bleeding and in need of medical assistance"" after breaking items inside a home on Detour Road, police said. When deputies arrived and attempted to restrain Pringle, he allegedly punched one of the deputies in the head and injured another deputy's ankle. Pringle lost consciousness after being tasered and physically restrained. He died a few days later.",Pending investigation,Less-than-lethal force,http://www.thestate.com/latest-news/article201569029.html,Yes,,,,3469
23865,Rosael Gutierrez-Toledo,35,Male,Hispanic/Latino,Hispanic/Latino,Not imputed,https://www.fatalencounters.org/wp-content/uploads/2018/03/Rosael-Gutierrez-Toledo.jpg,02/11/2018,Read Street and Remount Road,North Charleston,SC,29406,Charleston,Read Street and Remount Road North Charleston SC 29406 Charleston,32.9006111,-80.0042054,Hanahan Police Department,Vehicle,,,Unarmed,None,None,Not fleeing,,,"Rosael Gutierrez-Toledo was struck and killed by a vehicle whose driver was running from Hanahan police who were trying to stop for alleged drunken driving, police said. A month after the death, the driver had not been caught.",Unreported,Pursuit,http://abcnews4.com/news/local/hanahan-pedestrian-dies-in-hit-and-run-during-police-chase,Drug or alcohol use,,,,23865
23678,Name withheld by police,,Male,Race unspecified,Race unspecified,Race not determined,,01/24/2018,Hunt Club Run and Bees Ferry Rd,Charleston,SC,29455,Charleston,Hunt Club Run and Bees Ferry Rd Charleston SC 29455 Charleston,32.8086033,-80.1118102,Charleston County Sheriff's Office,Gunshot,,,Armed,Firearm/Handgun,Self-inflicted injury,Fleeing/Vehicle,,,"Deputies were sent to investigate a domestic disturbance at a home, police said. A man reportedly involved in the disturbance left in a vehicle before they arrived. Deputies found the man, but said he took off in his vehicle as they approached. After a short vehicle pursuit, he stopped in front of a home. When deputies attempted to confront him, he produced a handgun and shot and killed himself while he was still in his vehicle.",Suicide,Suicide,http://www.live5news.com/story/37342663/deputies-man-fatally-shoots-himself-after-west-ashley-traffic-stop,No,,,,23678
